{
  "$schema": "http://json-schema.org/draft-07/schema#",
  "$id": "https://yaagents.io/schemas/v0.1/clarification-required.schema.json",
  "title": "Clarification Required",
  "description": "Body for application/vnd.yaagents.clarification+json (HTTP 400). The agent requires additional inputs before it can proceed.",
  "type": "object",
  "required": ["type", "code", "message", "requiredInputs", "trace"],
  "additionalProperties": false,
  "properties": {
    "type": {
      "type": "string",
      "const": "clarification_required",
      "description": "Discriminator identifying this response type."
    },
    "code": {
      "type": "string",
      "const": "CLARIFICATION_REQUIRED",
      "description": "Machine-readable error code."
    },
    "message": {
      "type": "string",
      "description": "Human-readable description of the clarification requirement."
    },
    "requiredInputs": {
      "type": "array",
      "minItems": 1,
      "description": "One or more inputs the caller must supply to proceed.",
      "items": {
        "$ref": "#/definitions/requiredInput"
      }
    },
    "trace": {
      "$ref": "#/definitions/trace"
    }
  },
  "definitions": {
    "trace": {
      "type": "object",
      "description": "Correlation identifiers propagated from the inbound request.",
      "required": ["correlationId", "requestId"],
      "additionalProperties": false,
      "properties": {
        "correlationId": {
          "type": "string",
          "minLength": 1,
          "description": "Cross-service correlation identifier (X-Correlation-ID header)."
        },
        "requestId": {
          "type": "string",
          "minLength": 1,
          "description": "Per-request unique identifier (X-Request-ID header)."
        }
      }
    },
    "requiredInput": {
      "type": "object",
      "description": "A single input the caller must supply to proceed.",
      "required": ["name", "location", "type", "required", "question"],
      "additionalProperties": false,
      "properties": {
        "name": {
          "type": "string",
          "description": "Field or parameter identifier the caller must supply."
        },
        "location": {
          "type": "string",
          "enum": ["body", "query", "path", "header"],
          "description": "Where in the request this input should be placed."
        },
        "type": {
          "type": "string",
          "enum": ["string", "integer", "boolean", "array", "object"],
          "description": "JSON type hint for the expected value."
        },
        "required": {
          "type": "boolean",
          "description": "Whether this input is mandatory to proceed."
        },
        "question": {
          "type": "string",
          "description": "Human-readable prompt surfaced to the end user."
        },
        "allowedValues": {
          "type": "array",
          "items": {"type": "string"},
          "description": "Optional enumeration of acceptable string values."
        }
      }
    }
  }
}
